{
  "$schema": "https://json-schema.org/draft/2020-12/schema",
  "$id": "https://klimpaskov.github.io/hoi4-mod-setup/schemas/transaction-journal.schema.json",
  "title": "Transaction Journal",
  "type": "object",
  "additionalProperties": false,
  "required": [
    "schema_version",
    "transaction_id",
    "transaction_kind",
    "parent_transaction_id",
    "rollback_transaction_id",
    "result_lock_sha256",
    "result_lock_exists",
    "rollback_record_sha256",
    "project_id",
    "project_root",
    "project_root_lifecycle",
    "state",
    "created_at",
    "updated_at",
    "last_checkpoint",
    "plan_sha256",
    "stages",
    "operations",
    "recovery",
    "git_initialized",
    "git_remote_added_name",
    "git_remote_added_url",
    "previous_lock_backup_path",
    "previous_lock_sha256",
    "error"
  ],
  "properties": {
    "schema_version": {
      "enum": ["1.0.0", "1.1.0"]
    },
    "transaction_id": {
      "type": "string",
      "format": "uuid"
    },
    "transaction_kind": {
      "enum": [
        "installation",
        "rollback"
      ]
    },
    "parent_transaction_id": {
      "type": [
        "string",
        "null"
      ],
      "format": "uuid"
    },
    "rollback_transaction_id": {
      "type": [
        "string",
        "null"
      ],
      "format": "uuid"
    },
    "project_id": {
      "type": "string"
    },
    "project_root": {
      "type": "string"
    },
    "project_root_lifecycle": {
      "type": "object",
      "additionalProperties": false,
      "required": [
        "mode",
        "canonical_parent",
        "leaf",
        "checkpoint",
        "created_by_transaction",
        "observed_exists",
        "cleanup_result"
      ],
      "properties": {
        "mode": {
          "enum": [
            "existing",
            "create_leaf"
          ]
        },
        "canonical_parent": {
          "type": [
            "string",
            "null"
          ]
        },
        "leaf": {
          "type": [
            "string",
            "null"
          ]
        },
        "root_identity": {
          "type": [
            "string",
            "null"
          ],
          "pattern": "^(unix:[0-9a-f]+:[0-9a-f]+|windows-v2:[0-9a-f]{16}:[0-9a-f]{32})$"
        },
        "parent_identity": {
          "type": [
            "string",
            "null"
          ],
          "pattern": "^(unix:[0-9a-f]+:[0-9a-f]+|windows-v2:[0-9a-f]{16}:[0-9a-f]{32})$"
        },
        "checkpoint": {
          "enum": [
            "not_required",
            "pending",
            "applying",
            "created",
            "removing",
            "removed",
            "retained_user_content"
          ]
        },
        "created_by_transaction": {
          "type": "boolean"
        },
        "observed_exists": {
          "type": "boolean"
        },
        "cleanup_result": {
          "type": [
            "string",
            "null"
          ]
        }
      }
    },
    "primary_coding_environment": {
      "type": "string",
      "pattern": "^[a-z][a-z0-9_]{0,63}$"
    },
    "additional_coding_environments": {
      "type": "array",
      "uniqueItems": true,
      "items": {
        "type": "string",
        "pattern": "^[a-z][a-z0-9_]{0,63}$"
      }
    },
    "state": {
      "enum": [
        "preflight",
        "resolving",
        "downloading",
        "verifying",
        "reviewed",
        "backing_up",
        "staging",
        "validating",
        "applying",
        "post_check",
        "reporting",
        "finalizing",
        "completed",
        "interrupted",
        "staging_discarded",
        "rolling_back",
        "rolled_back",
        "failed"
      ]
    },
    "created_at": {
      "type": "string",
      "format": "date-time"
    },
    "updated_at": {
      "type": "string",
      "format": "date-time"
    },
    "last_checkpoint": {
      "type": "string"
    },
    "plan_sha256": {
      "type": "string",
      "pattern": "^[0-9a-f]{64}$"
    },
    "git_remote_added_name": {
      "type": [
        "string",
        "null"
      ]
    },
    "git_remote_added_url": {
      "type": [
        "string",
        "null"
      ]
    },
    "stages": {
      "type": "array",
      "minItems": 12,
      "maxItems": 12,
      "prefixItems": [
        { "allOf": [{ "$ref": "#/$defs/stage" }, { "properties": { "id": { "const": "preflight" } } }] },
        { "allOf": [{ "$ref": "#/$defs/stage" }, { "properties": { "id": { "const": "repository source resolution" } } }] },
        { "allOf": [{ "$ref": "#/$defs/stage" }, { "properties": { "id": { "const": "selective download" } } }] },
        { "allOf": [{ "$ref": "#/$defs/stage" }, { "properties": { "id": { "const": "checksum verification" } } }] },
        { "allOf": [{ "$ref": "#/$defs/stage" }, { "properties": { "id": { "const": "dry-run review" } } }] },
        { "allOf": [{ "$ref": "#/$defs/stage" }, { "properties": { "id": { "const": "backup" } } }] },
        { "allOf": [{ "$ref": "#/$defs/stage" }, { "properties": { "id": { "const": "staging" } } }] },
        { "allOf": [{ "$ref": "#/$defs/stage" }, { "properties": { "id": { "const": "validation" } } }] },
        { "allOf": [{ "$ref": "#/$defs/stage" }, { "properties": { "id": { "const": "apply" } } }] },
        { "allOf": [{ "$ref": "#/$defs/stage" }, { "properties": { "id": { "const": "post-install checks" } } }] },
        { "allOf": [{ "$ref": "#/$defs/stage" }, { "properties": { "id": { "const": "readiness report" } } }] },
        { "allOf": [{ "$ref": "#/$defs/stage" }, { "properties": { "id": { "const": "rollback record" } } }] }
      ],
      "items": false
    },
    "operations": {
      "type": "array",
      "items": {
        "type": "object",
        "required": [
          "id",
          "status",
          "destination",
          "ownership",
          "component_id",
          "source_path",
          "source_size",
          "action",
          "location_scope",
          "external",
          "backup_path",
          "before_sha256",
          "before_executable",
          "expected_sha256",
          "expected_executable",
          "source_sha256",
          "result_sha256",
          "rollback",
          "rollback_source_path",
          "resolution",
          "backup_sha256",
          "staged_sha256",
          "after_sha256",
          "after_exists",
          "after_executable"
        ],
        "properties": {
          "id": {
            "type": "string"
          },
          "status": {
            "enum": [
              "pending",
              "staged",
              "applying",
              "applied",
              "verified",
              "rollback_applying",
              "rolled_back",
              "failed"
            ]
          },
          "destination": {
            "type": "string"
          },
          "ownership": {
            "enum": [
              "managed",
              "merged",
              "generated",
              "external"
            ]
          },
          "component_id": {
            "type": [
              "string",
              "null"
            ]
          },
          "source_path": {
            "type": [
              "string",
              "null"
            ]
          },
          "source_size": {
            "type": [
              "integer",
              "null"
            ],
            "minimum": 0
          },
          "action": {
            "enum": [
              "create",
              "replace",
              "merge",
              "rename",
              "skip",
              "delete_managed",
              "generate",
              "chmod",
              "external",
              null
            ]
          },
          "location_scope": {
            "enum": [
              "project",
              "external_launcher",
              "application_data",
              null
            ]
          },
          "external": {
            "type": "boolean"
          },
          "backup_path": {
            "type": [
              "string",
              "null"
            ]
          },
          "before_sha256": {
            "type": [
              "string",
              "null"
            ]
          },
          "before_executable": {
            "type": [
              "boolean",
              "null"
            ]
          },
          "expected_sha256": {
            "type": [
              "string",
              "null"
            ]
          },
          "expected_executable": {
            "type": [
              "boolean",
              "null"
            ]
          },
          "source_sha256": {
            "type": [
              "string",
              "null"
            ],
            "pattern": "^[0-9a-f]{64}$"
          },
          "result_sha256": {
            "type": [
              "string",
              "null"
            ],
            "pattern": "^[0-9a-f]{64}$"
          },
          "rollback": {
            "enum": [
              "remove_created",
              "restore_backup",
              "reverse_merge",
              "none",
              null
            ]
          },
          "rollback_source_path": {
            "type": [
              "string",
              "null"
            ]
          },
          "resolution": {
            "type": [
              "string",
              "null"
            ]
          },
          "backup_sha256": {
            "type": [
              "string",
              "null"
            ],
            "pattern": "^[0-9a-f]{64}$"
          },
          "staged_sha256": {
            "type": [
              "string",
              "null"
            ],
            "pattern": "^[0-9a-f]{64}$"
          },
          "after_sha256": {
            "type": [
              "string",
              "null"
            ],
            "pattern": "^[0-9a-f]{64}$"
          },
          "after_exists": {
            "type": [
              "boolean",
              "null"
            ]
          },
          "after_executable": {
            "type": [
              "boolean",
              "null"
            ]
          },
          "quarantine_leaf": {
            "description": "Same-directory name that holds the displaced destination while the operation replaces or deletes it. Recovery accepts only the name derived from the transaction and operation IDs.",
            "type": [
              "string",
              "null"
            ],
            "pattern": "^\\.hoi4ms-quarantine-[0-9a-f]{32}-[A-Za-z0-9_-]{1,64}\\.tmp$"
          },
          "quarantine_sha256": {
            "description": "Observed SHA-256 of the quarantined bytes. Absent while the quarantine is planned but not verified; a value different from backup_sha256 records local bytes that changed after review and were preserved. When rollback moves a surviving forward quarantine back, it records the hash of the bytes it moved back.",
            "type": [
              "string",
              "null"
            ],
            "pattern": "^[0-9a-f]{64}$"
          },
          "external_parent_identity": {
            "description": "Identity of an external destination's parent directory, copied from the reviewed plan operation or, for a plan without one, bound when the transaction first opens that parent through a retained handle (the backup stage). Apply, post-install checks, finalization, and rollback reopen the parent only when it still has this identity, and a bound parent is never recreated. When the operation may have changed its destination (a leaf-changing action past the pending and staged states), a missing bound parent stops recovery instead of reading as an absent destination. Rollback journals copy it from their parent operation. Omitted for project destinations and for operations from before the binding.",
            "type": [
              "string",
              "null"
            ],
            "pattern": "^(unix:[0-9a-f]+:[0-9a-f]+|windows-v2:[0-9a-f]{16}:[0-9a-f]{32})$"
          }
        },
        "dependentRequired": {
          "quarantine_sha256": ["quarantine_leaf"]
        },
        "if": {
          "required": ["quarantine_sha256"],
          "properties": { "quarantine_sha256": { "type": "string" } }
        },
        "then": {
          "properties": { "quarantine_leaf": { "type": "string" } }
        }
      }
    },
    "created_directories": {
      "type": "array",
      "uniqueItems": true,
      "items": {
        "type": "string",
        "minLength": 1
      }
    },
    "recovery": {
      "type": "object",
      "required": [
        "resume_allowed",
        "rollback_allowed",
        "discard_staging_allowed",
        "project_apply_started",
        "recommended_action"
      ],
      "properties": {
        "resume_allowed": {
          "type": "boolean"
        },
        "rollback_allowed": {
          "type": "boolean"
        },
        "discard_staging_allowed": {
          "type": "boolean"
        },
        "project_apply_started": {
          "type": "boolean"
        },
        "recommended_action": {
          "enum": [
            "resume",
            "rollback",
            "discard_staging",
            "inspect",
            "none"
          ]
        }
      }
    },
    "git_initialized": {
      "type": "boolean"
    },
    "previous_lock_backup_path": {
      "type": [
        "string",
        "null"
      ]
    },
    "previous_lock_sha256": {
      "type": [
        "string",
        "null"
      ],
      "pattern": "^[0-9a-f]{64}$"
    },
    "checkpoint_sequence": {
      "description": "Sequence of the last operation checkpoint this snapshot includes. Replay applies only checkpoint records with a higher sequence; journals written before the field existed omit it and replay by timestamp.",
      "type": "integer",
      "minimum": 0
    },
    "app_data_identity": {
      "description": "Identities of the application-data directories that hold this transaction's storage, each captured through the retained handle that first creates or opens it. Every later call (stages, resume, rollback, staging discard, finalization, and discovery of an incomplete journal) opens these directories through the retained application-data root and refuses one whose identity differs, so a directory swapped away and replaced, or replaced by a link, is not followed. A bound directory is never recreated. Rollback journals bind their own transaction and backup directories and have no staging directory. Journals written before the binding omit the field and keep path-based access to their storage.",
      "type": "object",
      "additionalProperties": false,
      "required": ["root", "transaction"],
      "properties": {
        "root": {
          "description": "The application-data root that holds transactions/, backups/, and staging/.",
          "type": "string",
          "pattern": "^(unix:[0-9a-f]+:[0-9a-f]+|windows-v2:[0-9a-f]{16}:[0-9a-f]{32})$"
        },
        "transaction": {
          "description": "transactions/<transaction_id>: the journal, plan, checkpoint log, readiness report, and rollback record.",
          "type": "string",
          "pattern": "^(unix:[0-9a-f]+:[0-9a-f]+|windows-v2:[0-9a-f]{16}:[0-9a-f]{32})$"
        },
        "backup": {
          "description": "backups/<transaction_id>, bound when the backup stage or rollback preparation creates it.",
          "type": "string",
          "pattern": "^(unix:[0-9a-f]+:[0-9a-f]+|windows-v2:[0-9a-f]{16}:[0-9a-f]{32})$"
        },
        "staging": {
          "description": "staging/<transaction_id>, bound when the staging stage creates it.",
          "type": "string",
          "pattern": "^(unix:[0-9a-f]+:[0-9a-f]+|windows-v2:[0-9a-f]{16}:[0-9a-f]{32})$"
        }
      }
    },
    "result_lock_sha256": {
      "type": [
        "string",
        "null"
      ],
      "pattern": "^[0-9a-f]{64}$"
    },
    "result_lock_exists": {
      "type": [
        "boolean",
        "null"
      ]
    },
    "rollback_record_sha256": {
      "type": [
        "string",
        "null"
      ],
      "pattern": "^[0-9a-f]{64}$"
    },
    "error": {
      "type": [
        "object",
        "null"
      ],
      "properties": {
        "code": {
          "type": "string"
        },
        "message": {
          "type": "string"
        },
        "stage": {
          "type": "string"
        }
      }
    }
  },
  "allOf": [
    {
      "if": { "properties": { "schema_version": { "const": "1.0.0" } } },
      "then": {
        "properties": {
          "operations": {
            "items": {
              "properties": {
                "quarantine_leaf": false,
                "quarantine_sha256": false,
                "external_parent_identity": false
              }
            }
          },
          "checkpoint_sequence": false,
          "app_data_identity": false
        }
      }
    },
    {
      "if": { "properties": { "schema_version": { "const": "1.1.0" } } },
      "then": {
        "properties": {
          "project_root_lifecycle": {
            "required": ["root_identity", "parent_identity"],
            "allOf": [
              {
                "if": { "properties": { "mode": { "const": "existing" } } },
                "then": {
                  "properties": {
                    "root_identity": { "type": "string" },
                    "parent_identity": { "type": "null" }
                  }
                }
              },
              {
                "if": { "properties": { "mode": { "const": "create_leaf" } } },
                "then": {
                  "properties": { "parent_identity": { "type": "string" } },
                  "allOf": [
                    {
                      "if": {
                        "properties": {
                          "checkpoint": {
                            "enum": ["created", "removing", "removed", "retained_user_content"]
                          }
                        }
                      },
                      "then": { "properties": { "root_identity": { "type": "string" } } }
                    },
                    {
                      "if": { "properties": { "checkpoint": { "const": "pending" } } },
                      "then": { "properties": { "root_identity": { "type": "null" } } }
                    }
                  ]
                }
              }
            ]
          }
        }
      }
    }
  ],
  "$defs": {
    "stage": {
      "type": "object",
      "additionalProperties": false,
      "required": [
        "id",
        "status",
        "started_at",
        "completed_at",
        "evidence"
      ],
      "properties": {
        "id": { "type": "string" },
        "status": {
          "enum": ["pending", "active", "complete", "failed", "skipped"]
        },
        "started_at": {
          "type": ["string", "null"],
          "format": "date-time"
        },
        "completed_at": {
          "type": ["string", "null"],
          "format": "date-time"
        },
        "evidence": {
          "type": "array",
          "maxItems": 4096,
          "items": { "type": "string", "maxLength": 1024 }
        }
      }
    }
  }
}
