{
  "schema_version": "1.1.0",
  "transaction_id": "960ccbb7-c36a-41b0-9d76-0105bcd83b05",
  "transaction_kind": "installation",
  "parent_transaction_id": null,
  "rollback_transaction_id": null,
  "result_lock_sha256": null,
  "result_lock_exists": null,
  "rollback_record_sha256": null,
  "project_id": "cold_war_curtain",
  "project_root": "C:\\Users\\example\\OneDrive\\Documents\\Paradox Interactive\\Hearts of Iron IV\\mod\\cold_war_curtain",
  "project_root_lifecycle": {
    "mode": "create_leaf",
    "canonical_parent": "C:\\Users\\example\\OneDrive\\Documents\\Paradox Interactive\\Hearts of Iron IV\\mod",
    "leaf": "cold_war_curtain",
    "root_identity": null,
    "parent_identity": "windows-v2:0000000000000001:00000000000000000000000000000001",
    "checkpoint": "pending",
    "created_by_transaction": false,
    "observed_exists": false,
    "cleanup_result": null
  },
  "state": "interrupted",
  "created_at": "2026-07-25T17:40:00+03:00",
  "updated_at": "2026-07-25T17:41:42+03:00",
  "last_checkpoint": "stage-07-file-1498",
  "plan_sha256": "7777777777777777777777777777777777777777777777777777777777777777",
  "stages": [
    {
      "id": "preflight",
      "status": "complete",
      "started_at": "2026-07-25T17:40:00+03:00",
      "completed_at": "2026-07-25T17:40:02+03:00",
      "evidence": [
        "preflight.json"
      ]
    },
    {
      "id": "repository source resolution",
      "status": "complete",
      "started_at": "2026-07-25T17:40:02+03:00",
      "completed_at": "2026-07-25T17:40:04+03:00",
      "evidence": [
        "source-resolution.json"
      ]
    },
    {
      "id": "selective download",
      "status": "complete",
      "started_at": "2026-07-25T17:40:04+03:00",
      "completed_at": "2026-07-25T17:40:40+03:00",
      "evidence": [
        "download-ledger.json"
      ]
    },
    {
      "id": "checksum verification",
      "status": "complete",
      "started_at": "2026-07-25T17:40:40+03:00",
      "completed_at": "2026-07-25T17:40:55+03:00",
      "evidence": [
        "checksum-report.json"
      ]
    },
    {
      "id": "dry-run review",
      "status": "complete",
      "started_at": "2026-07-25T17:40:55+03:00",
      "completed_at": "2026-07-25T17:41:10+03:00",
      "evidence": [
        "approved-plan.json"
      ]
    },
    {
      "id": "backup",
      "status": "complete",
      "started_at": "2026-07-25T17:41:10+03:00",
      "completed_at": "2026-07-25T17:41:20+03:00",
      "evidence": [
        "backup-manifest.json"
      ]
    },
    {
      "id": "staging",
      "status": "active",
      "started_at": "2026-07-25T17:41:20+03:00",
      "completed_at": null,
      "evidence": [
        "staging-ledger.json"
      ]
    },
    {
      "id": "validation",
      "status": "pending",
      "started_at": null,
      "completed_at": null,
      "evidence": []
    },
    {
      "id": "apply",
      "status": "pending",
      "started_at": null,
      "completed_at": null,
      "evidence": []
    },
    {
      "id": "post-install checks",
      "status": "pending",
      "started_at": null,
      "completed_at": null,
      "evidence": []
    },
    {
      "id": "readiness report",
      "status": "pending",
      "started_at": null,
      "completed_at": null,
      "evidence": []
    },
    {
      "id": "rollback record",
      "status": "pending",
      "started_at": null,
      "completed_at": null,
      "evidence": []
    }
  ],
  "operations": [
    {
      "id": "op-001",
      "status": "staged",
      "destination": "AGENTS.md",
      "ownership": "merged",
      "component_id": "core.agents",
      "source_path": "AGENTS_template.md",
      "source_size": 12,
      "action": "replace",
      "location_scope": "project",
      "external": false,
      "backup_path": "C:\\Users\\example\\AppData\\Local\\HOI4 Mod Setup\\backups\\960ccbb7-c36a-41b0-9d76-0105bcd83b05\\op-001.bak",
      "rollback_source_path": null,
      "resolution": "replace",
      "source_sha256": "4444444444444444444444444444444444444444444444444444444444444444",
      "result_sha256": "6666666666666666666666666666666666666666666666666666666666666666",
      "expected_sha256": "6666666666666666666666666666666666666666666666666666666666666666",
      "rollback": "restore_backup",
      "backup_sha256": "4444444444444444444444444444444444444444444444444444444444444444",
      "staged_sha256": "6666666666666666666666666666666666666666666666666666666666666666",
      "before_sha256": "4444444444444444444444444444444444444444444444444444444444444444",
      "before_executable": false,
      "expected_executable": false,
      "after_sha256": null,
      "after_exists": null,
      "after_executable": null,
      "quarantine_leaf": null,
      "quarantine_sha256": null
    },
    {
      "id": "op-002",
      "status": "staged",
      "destination": ".agents/skills/hoi4-events/SKILL.md",
      "ownership": "managed",
      "component_id": "core.skills",
      "source_path": ".agents/skills/hoi4-events/SKILL.md",
      "source_size": 14,
      "action": "create",
      "location_scope": "project",
      "external": false,
      "backup_path": null,
      "rollback_source_path": null,
      "resolution": null,
      "source_sha256": "5555555555555555555555555555555555555555555555555555555555555555",
      "result_sha256": "5555555555555555555555555555555555555555555555555555555555555555",
      "expected_sha256": "5555555555555555555555555555555555555555555555555555555555555555",
      "rollback": "remove_created",
      "backup_sha256": null,
      "staged_sha256": "5555555555555555555555555555555555555555555555555555555555555555",
      "before_sha256": null,
      "before_executable": null,
      "expected_executable": false,
      "after_sha256": null,
      "after_exists": null,
      "after_executable": null
    }
  ],
  "created_directories": [
    "events",
    "localisation",
    "localisation/english"
  ],
  "recovery": {
    "resume_allowed": true,
    "rollback_allowed": true,
    "discard_staging_allowed": true,
    "project_apply_started": false,
    "recommended_action": "resume"
  },
  "git_initialized": false,
  "git_remote_added_name": null,
  "git_remote_added_url": null,
  "previous_lock_backup_path": "C:\\Users\\example\\AppData\\Local\\HOI4 Mod Setup\\backups\\960ccbb7-c36a-41b0-9d76-0105bcd83b05\\install.lock.json.bak",
  "previous_lock_sha256": "8888888888888888888888888888888888888888888888888888888888888888",
  "error": {
    "code": "APP_TERMINATED",
    "message": "The application closed during staging.",
    "stage": "staging"
  }
}
